{
  "domain": "java-launch-paper",
  "case": "sandbox-suppress-flags-present",
  "source": {
    "file": "HeadlessScriptGeneratorTests.swift",
    "test": "testSandboxSuppressFlagsPresent",
    "line": 288
  },
  "input": {
    "validatedJava": {
      "executablePath": "/usr/bin/java",
      "prefixArguments": []
    },
    "serverDir": "/srv/mc",
    "paperJarPath": "server.jar",
    "minRamGB": 1,
    "maxRamGB": 2,
    "extraFlags": "",
    "existingFiles": [
      "/srv/mc/server.jar"
    ]
  },
  "expected": {
    "executablePath": "/usr/bin/java",
    "workingDirectory": "/srv/mc",
    "arguments": [
      "-Xms1024M",
      "-Xmx2048M",
      "-Djna.nosys=true",
      "-Djna.nounpack=true",
      "-Djline.terminal=dumb",
      "-Dio.netty.noUnsafe=true",
      "-jar",
      "server.jar",
      "--nogui"
    ],
    "argumentsContains": [
      "-Djna.nosys=true",
      "-Djna.nounpack=true",
      "-Djline.terminal=dumb",
      "-Dio.netty.noUnsafe=true"
    ]
  },
  "notes": "These sandbox-suppression flags are unconditional JVM flags in MSC 1 and must appear before -jar."
}
