{
  "domain": "curseforge-modpack",
  "case": "detect-kind-curse-forge",
  "source": {
    "file": "CurseForgeModpackTests.swift",
    "test": "testDetectKindCurseForge",
    "line": 155
  },
  "input": {
    "function": "CurseForgeModpack.detectKind",
    "fsTree": {
      "<TMP>/manifest.json": {
        "type": "file",
        "content": "{\"minecraft\": {\"version\": \"1.20.1\", \"modLoaders\": [{\"id\": \"forge-47.4.1\", \"primary\": true}]}, \"manifestType\": \"minecraftModpack\", \"manifestVersion\": 1, \"name\": \"Better MC [FORGE] BMC4\", \"version\": \"43\", \"author\": \"Luna Pixel Studios\", \"files\": [{\"projectID\": 306612, \"fileID\": 5000001, \"required\": true}, {\"projectID\": 238222, \"fileID\": 5000002, \"required\": true}], \"overrides\": \"overrides\"}"
      }
    },
    "root": "<TMP>"
  },
  "expected": "curseForge"
}
